[{"region_id":1,"code":"RD","name_ar":"منطقة الرياض","name_en":"Riyadh","capital_city_id":3,"center":[24.69999996,46.73333003],"bbox":[41.6860256,19.2083336,48.1837998,27.7020999]},{"region_id":2,"code":"MQ","name_ar":"منطقة مكة المكرمة","name_en":"Makkah","capital_city_id":6,"center":[21.42717994,39.84349001],"bbox":[38.61693,18.5646906,43.83016,23.6952001]},{"region_id":3,"code":"MN","name_ar":"منطقة المدينة المنورة","name_en":"Madinah","capital_city_id":14,"center":[24.47057996,39.60781006],"bbox":[37.084,22.5197101,42.1566,27.4666499]},{"region_id":4,"code":"QA","name_ar":"منطقة القصيم","name_en":"Qassim","capital_city_id":11,"center":[26.33033999,43.97435997],"bbox":[41.3073127,24.4836001,44.9894666,28.2507999]},{"region_id":5,"code":"SQ","name_ar":"المنطقة الشرقية","name_en":"Eastern Province","capital_city_id":13,"center":[26.44199002,50.10919981],"bbox":[44.6706644,19.0005171,55.6666667,29.1413858]},{"region_id":6,"code":"AS","name_ar":"منطقة عسير","name_en":"Asir","capital_city_id":15,"center":[18.21667,42.50000002],"bbox":[41.2142233,17.3666667,44.4407886,20.8026601]},{"region_id":7,"code":"TB","name_ar":"منطقة تبوك","name_en":"Tabuk","capital_city_id":1,"center":[28.41463997,36.53387003],"bbox":[34.4956652,24.560725,39.92296,29.9761406]},{"region_id":8,"code":"HA","name_ar":"منطقة حائل","name_en":"Hail","capital_city_id":10,"center":[27.53054999,41.69733002],"bbox":[39.11418,25.2543901,44.3676607,29.2078762]},{"region_id":9,"code":"SH","name_ar":"منطقة الحدود الشمالية","name_en":"Northern Borders","capital_city_id":2213,"center":[30.97214998,41.01332997],"bbox":[37.9552529,27.8317607,45.4641414,32.1539618]},{"region_id":10,"code":"GA","name_ar":"منطقة جازان","name_en":"Jazan","capital_city_id":17,"center":[16.89671995,42.55360001],"bbox":[41.38948,16.0884301,43.3365,18.0603979]},{"region_id":11,"code":"NG","name_ar":"منطقة نجران","name_en":"Najran","capital_city_id":3417,"center":[17.5408618,44.2663834],"bbox":[43.59569,16.95,52.0017527,19.4488889]},{"region_id":12,"code":"BA","name_ar":"منطقة الباحة","name_en":"Bahah","capital_city_id":1542,"center":[20.00695006,41.46314],"bbox":[40.8291644,19.4458102,42.1297162,20.8293801]},{"region_id":13,"code":"GO","name_ar":"منطقة الجوف","name_en":"Jawf","capital_city_id":2237,"center":[29.9728,40.21416997],"bbox":[37.0058749,28.3679399,41.99684,31.7498732]}]